Book I, Chapter I First, How Uther Pendragon Sent for the Duke of Cornwall and Igraine His Wife, and of Their Departing Suddenly Again It befell in the days of Uther Pendragon, when he was king of all England, and so reigned, that there was a mighty duke in Cornwall that held war against him long time. And the duke was called the Duke of Tintagil. And so by means King Uther sent for this duke, charging him to bring his wife with him, for she was called a fair lady, and a passing wise, and her name was called Igraine.​So when the duke and his wife were come unto the king, by the means of great lords they were accorded both. The king liked and loved this lady well, and he made them great cheer out of measure, and desired to have lain by her. But she was a passing good woman, and would not assent unto the king. And then she told the duke her husband, and said, I suppose that we were sent for that I should be dishonoured; wherefore, husband, I counsel you, that we depart from hence suddenly, that we may ride all night unto our own castle. And in like wise as she said so they departed, that neither the king nor none of his council were ware of their departing.​ All so soon as King Uther knew of their departing so suddenly, he was wonderly wroth. Then he called to him his privy council, and told them of the sudden departing of the duke and his wife. Then they advised the king to send for the duke and his wife by a great charge; and if he will not come at your summons, then may ye do your best, then have ye cause to make mighty war upon him. So that was done, and the messengers had their answers; and that was this shortly, that neither he nor his wife would not come at him.​When the duke had this warning, anon he went and furnished and garnished two strong castles of his, of the which the one hight Tintagil, and the other castle hight Terrabil. So his wife Dame Igraine he put in the castle of Tintagil, and himself he put in the castle of Terrabil, the which had many issues and posterns out. Then in all haste came Uther with a great host, and laid a siege about the castle of Terrabil.​
Act 1, Scene 1 Enter Sampson and Gregory, of the house of Capulet, armed with swords and bucklers. Sampson: Gregory, o' my word, we'll not carry coals. Gregory: No, for then we should be colliers. Sampson: I mean, and we be in choler, we'll draw. Gregory: Ay, while you live, draw your neck out of collar. Sampson: I strike quickly, being moved. Gregory: But thou art not quickly moved to strike. Sampson: A dog of the house of Montague moves me. Gregory: To move is to stir, and to be valiant is to stand: therefore, if thou art moved, thou runn'st away. Sampson: A dog of that house shall move me to stand: I will take the wall of any man or maid of Montague's. Gregory: That shows thee a weak slave; for the weakest goes to the wall. Sampson: True; and therefore women, being the weaker vessels, are ever thrust to the wall: therefore I will push Montague's men from the wall, and thrust his maids to the wall. Gregory: The quarrel is between our masters and us their men. Sampson: 'Tis all one, I will show myself a tyrant: when I have fought with the men, I will be cruel with the maids, and cut off their heads. Gregory: The heads of the maids? Sampson: Ay, the heads of the maids, or their maidenheads; take it in what sense thou wilt. Gregory: They must take it in sense that feel it. Sampson: Me they shall feel while I am able to stand: and 'tis known I am a pretty piece of flesh. Gregory: 'Tis well thou art not fish; if thou hadst, thou hadst been poor John. Draw thy tool; here comes two of the house of the Montagues. Sampson: My naked weapon is out: quarrel, I will back thee. Gregory: How? turn thy back and run? Sampson: Fear me not. Gregory: No, marry; I fear thee! Sampson: Let us take the law of our sides; let them begin. Gregory: I will frown as I pass by, and let them take it as they list.
ACT I, SCENE I Rome. A street. Enter Flavius, Marullus, and certain Commoners. FLAVIUS Hence! home, you idle creatures, get you home: Is this a holiday? What! know you not, Being mechanical, you ought not walk Upon a labouring day without the sign Of your profession? Speak, what trade art thou? First Commoner Why, sir, a carpenter. MARULLUS Where is thy leather apron and thy rule? What dost thou with thy best apparel on? You, sir, what trade are you? Second Commoner Truly, sir, in respect of a fine workman, I am but, as you would say, a cobbler. MARULLUS But what trade art thou? Answer me directly. Second Commoner A trade, sir, that, I hope, I may use with a safe conscience; which is, indeed, sir, a mender of bad soles. FLAVIUS What trade, thou knave? thou naughty knave, what trade? Second Commoner Nay, I beseech you, sir, be not out with me: yet, if you be out, sir, I can mend you. MARULLUS What meanest thou by that? mend me, thou saucy fellow! Second Commoner Why, sir, cobble you.
THE TRAGEDY OF KING RICHARD THE SECOND ACT I, SCENE I London. King Richard’s palace. Enter KING RICHARD, JOHN OF GAUNT, with other Nobles and Attendants. KING RICHARD. Old John of Gaunt, time-honour’d Lancaster, Hast thou, according to thy oath and band, Brought hither Henry Hereford thy bold son, Here to make good the boisterous late appeal, Which then our leisure would not let us hear, Against the Duke of Norfolk, Thomas Mowbray? GAUNT. I have, my liege. KING RICHARD. Tell me, moreover, hast thou sounded him, If he appeal the duke on ancient malice, Or worthily, as a good subject should, On some known ground of treachery in him? GAUNT. As near as I could sift him on that argument, On some apparent danger seen in him Aim’d at your highness, no inveterate malice. KING RICHARD. Then call them to our presence: face to face, And frowning brow to brow, ourselves will hear The accuser and the accused freely speak: High-stomach’d are they both, and full of ire, In rage deaf as the sea, hasty as fire. Enter HENRY BOLINGBROKE and THOMAS MOWBRAY. BOLINGBROKE. Many years of happy days befall My gracious sovereign, my most loving liege!
CHAPTER I Imitating Christ and Despising All Vanities on Earth “He who follows Me, walks not in darkness,” says the Lord. By these words of Christ we are advised to imitate His life and habits, if we wish to be truly enlightened and free from all blindness of heart. Let our chief effort, therefore, be to study the life of Jesus Christ. The teaching of Christ is more excellent than all the advice of the saints, and he who has His Spirit will find in it a hidden manna. Now, there are many who frequently hear the Gospel but care little for it because they have not the spirit of Christ. Yet whoever wishes to understand fully the words of Christ must try to pattern his whole life on that of Christ. What good does it do to speak learnedly about the Trinity if, lacking humility, you displease the Trinity? Indeed it is not learning that makes a man holy and just, but a virtuous life makes him pleasing to God. I would rather feel contrition than know how to define it. If you knew the whole Bible by heart, and the sayings of all the philosophers, what good would it all be without the love and grace of God? “Vanity of vanities, and all is vanity,” except to love God and serve Him alone.
THE LIFE AND DEATH OF RICHARD THE THIRD ACT I, SCENE I London. A street. Enter GLOUCESTER (Richard, Duke of Gloucester). GLOUCESTER: Now is the winter of our discontent Made glorious summer by this sun of York; And all the clouds that lour’d upon our house In the deep bosom of the ocean buried. Now are our brows bound with victorious wreaths; Our bruised arms hung up for monuments; Our stern alarums changed to merry meetings, Our dreadful marches to delightful measures. Grim-visaged war hath smooth’d his wrinkled front; And now, instead of mounting barded steeds To fright the souls of fearful adversaries, He capers nimbly in a lady’s chamber To the lascivious pleasing of a lute. But I—that am not shaped for sportive tricks, Nor made to court an amorous looking-glass; I—that am rudely stamp’d and want love’s majesty To strut before a wanton ambling nymph; I—that am curtail’d of this fair proportion, Cheated of feature by dissembling nature, Deformed, unfinish’d, sent before my time Into this breathing world scarce half made up— And that so lamely and unfashionable That dogs bark at me as I halt by them— Why, I, in this weak piping time of peace, Have no delight to pass away the time, Unless to spy my shadow in the sun And descant on mine own deformity.
THE JEW OF MALTA By Christopher Marlowe THE PROLOGUE Enter MACHIAVEL. MACHIAVEL: Albeit the world think Machiavel is dead, Yet was his soul but flown beyond the Alps; And now the Guise is dead, is come from France To view this land, and frolic with his friends. To some perhaps my name is odious; But such as love me, guard me from their tongues, And let them know that I am Machiavel, And weigh not men, and therefore not men's words. Admir’d I am of those that hate me most: Though some speak openly against my books, Yet will they read me, and thereby attain To Peter’s chair: and when they cast me off, Are poison’d by my climbing followers. I count religion but a childish toy, And hold there is no sin but ignorance. Birds of the air will tell of murders past! I am asham’d to hear such fooleries. Many will talk of title to a crown: What right had Caesar to the empery? Might first made kings, and laws were then most sure When, like the Draco’s, they were writ in blood. Hence comes it that a strong-built citadel Commands much more than letters can import: Which maxim had [Phalaris] observ’d, H’ad never bellow’d, in a brazen bull, Of great ones’ envy. O! then we bring forth weeds, When our quick minds lie still; and our ills told us Is as our earing. Farewell, kind Machiavel. Exit.
THE RAIGNE OF KING EDWARD THE THIRD ACT I, SCENE I. Enter King Edward and Countess of Salisbury. KING EDWARD: Pardon me, Countess, I will stay no more; Lest being stay’d, I prove importunate. My tongue could plead, but I will spare it now; And give thee time to chide me, if thou canst. COUNTESS: To chide thee, Edward? If I should, I think Thou wouldst wilt under it, like a tall ship With too much sail under her noble keel. KING EDWARD: No, Countess, no; I am a soldier’s son: And bear a soldier’s heart, I think, I think: And therefore would I have my love forgot. Thou art no match for me. COUNTESS: I am no match for you? Why then, what am I? KING EDWARD: A woman! In my estimation Worth ten such Kings as I am. O, forgive me. That thus I do forget myself in thee. COUNTESS: I am your loyal subject, gracious lord, Not your equal. KING EDWARD: I know it well. Yet—let me pause. For in thy sight I see a thousand virtues, And in thy words a sweet persuasiveness, Which brings my passions to a treble height. But yet—I must not speak of this again.